{
  "schema": "LEAD-Meldung-v1",
  "_status": "final",
  "_entstehung": {
    "verfahren": "manuell",
    "werkzeug": "Fiktiver Szenariodatensatz KRITIS-LEAD (Orkantief „Ilka“, Landkreis Sonneberg)"
  },
  "land": "Thüringen",
  "meldende_stelle": "Landratsamt Sonneberg, Krisenstab (Übungsrolle, FIKTIV)",
  "meldezeitpunkt": "2026-10-14T08:30",
  "meldezeitraum": {
    "von": "2026-10-13T21:40",
    "bis": "2026-10-14T08:00"
  },
  "quellen": "[Q1] B – Verteilnetzbetreiber Netzgebiet Südthüringen (FIKTIV) (14.10.2026): Folgemeldung Stromausfall (Eingangsmeldung, FIKTIV) [Zugriff: 14.10.2026]. Datenstand: 14.10.2026, 08:00\n[Q2] B – Mobilfunknetzbetreiber B (FIKTIV) (14.10.2026): Erstmeldung Standortausfälle (Eingangsmeldung, FIKTIV) [Zugriff: 14.10.2026]. Datenstand: 14.10.2026, 07:00\n[Q3] B – Zweckverband Trinkwasser Neuhaus am Rennweg (FIKTIV) (14.10.2026): Erstmeldung Notstrom Pumpwerk (Eingangsmeldung, FIKTIV) [Zugriff: 14.10.2026]. Datenstand: 14.10.2026, 06:00\n[Q4] B – Pflegeträger Oberland (FIKTIV) (14.10.2026): Erstmeldung Notstrom Pflegeheime (Eingangsmeldung, FIKTIV) [Zugriff: 14.10.2026]. Datenstand: 14.10.2026, 07:15\n[Q5] A – Zentrale Leitstelle Sonneberg (Übungsrolle, FIKTIV) (14.10.2026): Erstmeldung Notrufabfrage (Eingangsmeldung, FIKTIV) [Zugriff: 14.10.2026]. Datenstand: 14.10.2026, 07:30\n[Q6] A – Landratsamt Sonneberg, Krisenstab (14.10.2026): Einwohnerzuordnung der Ausfallgebiete und Liste der Personen mit Heimbeatmung (behördenintern, FIKTIV) [Zugriff: 14.10.2026]. Datenstand: 14.10.2026, 08:00",
  "zeitstrahl": "[Z1] 2026-10-13T21:40 · DE-TH-20261014-K3SB · Ereignis – Stromausfall im Ausfallgebiet, in der Spitze rund 18.000 Anschlüsse [Q1] · aufgenommen 2026-10-14T08:30\n[Z2] 2026-10-14T02:00 · DE-TH-20261014-K3SB · Maßnahme – außergewöhnliches Ereignis festgestellt, Krisenstab einberufen [Q6] · aufgenommen 2026-10-14T08:30\n[Z3] 2026-10-14T04:30 · DE-TH-20261014-K3SB · Ereignis – Notruf aus vier Gemeinden eingeschränkt [Q5] · aufgenommen 2026-10-14T08:30",
  "sachverhalte": [
    {
      "kennung": "DE-TH-20261014-K3SB",
      "bezug": [
        "DE-TH-20261013-N4ST",
        "DE-TH-20261014-M7FB",
        "DE-TH-20261014-W2ZV",
        "DE-TH-20261014-P8HM",
        "DE-TH-20261014-G5RS"
      ],
      "eintritt": "2026-10-13T21:40",
      "art": [
        "Stromausfall / Blackout",
        "KRITIS-Ausfall"
      ],
      "ort": "Thüringen; Landkreis Sonneberg (Stadt Neuhaus am Rennweg, Gemeinden Frankenblick und Föritztal, Teile der Stadt Sonneberg)",
      "bezeichnung": "FIKTIV – Lagemeldung Nr. 4: Stromausfall im Landkreis Sonneberg, rund 9.800 Einwohner ohne Strom, Notruf eingeschränkt, Puffer enden vor der Wiederversorgung",
      "analyse": {
        "lage_ereignis": "FIKTIV – erfundene Lage (Szenario Orkantief „Ilka“, Landkreis Sonneberg; KRITIS-LEAD). Nach Mastschäden sind um 08:00 Uhr noch rund 5.300 Anschlüsse ohne Strom (Spitze rund 18.000) [Q1]; der Krisenstab ordnet ihnen rund 9.800 Einwohnerinnen und Einwohner zu [Q6]. 17 von 23 Mobilfunkstandorten sind ausgefallen [Q2], Notrufe aus vier Gemeinden erreichen die Leitstelle nur eingeschränkt [Q5]. Der Landkreis hat um 02:00 Uhr ein außergewöhnliches Ereignis festgestellt [Q6].",
        "risiken_auswirkungen": "Belegt: Zwei Pflegeheime (146 Bewohnerinnen und Bewohner) haben Diesel bis 15.10. abends [Q4]; die Trinkwasserversorgung Neuhaus am Rennweg reicht auf Notstrom bis 16.10., 10:00 Uhr [Q3]. Die Wiederversorgung ist für 16.10. abends angekündigt [Q1]. Zwölf Personen mit Heimbeatmung oder Sauerstoffversorgung sind bekannt, neun davon in Kliniken in Sonneberg und Coburg aufgenommen [Q6].",
        "massnahmen_empfehlungen": "Bestehende Maßnahmen: Krisenstab – acht Notfalltreffpunkte mit BOS-Funk, Wärme und Ladestrom; Status: wirksam; Stand: 14.10.2026, 08:00 [Q6]. Krisenstab – Dieselnachschub für Pumpwerk und Pflegeheime; Status: angefordert [Q3][Q4]. Unterstützung durch THW aus Oberfranken mit Netzersatzanlagen; Status: angefordert [Q6].",
        "abhaengigkeiten_interdependenzen": "Wirkungsketten: Mastbruch → Mobilfunk → Notruf [Q1][Q2][Q5]; Strom → Pflegeheime auf Notstrom, Puffer bis 15.10. abends [Q4]; Strom → Trinkwasser auf Notstrom, Puffer bis 16.10., 10:00 Uhr [Q3]. Gemeinsame Engpassressource: Dieselkraftstoff für Pumpwerk, Pflegeheime und mobile Netzersatzanlagen [Q2][Q3][Q4]."
      },
      "sofort": {
        "beurteilung": "kritisch",
        "tendenz": "Verschärfung",
        "bewertung_text": "Radarwerte illustrativ, nicht kalibriert (fiktives Szenario).\nKernaussage: Rund 9.800 Menschen sind bis voraussichtlich 16.10. abends ohne Strom; die Puffer von Pflege und Trinkwasser enden vorher, entscheidend ist der Dieselnachschub bis 15.10. mittags.\nNeubewertung bei: Ausfall eines Notstromaggregats; Verschiebung der Wiederversorgung.\nHandlungsrelevant bis: 15.10.2026 12:00 – Dieselnachschub für Pumpwerk (2.000 l) und Pflegeheime (1.500 l), Krisenstab – vor Ende der Notstromreichweiten; Grundlage: Betreibermeldungen [Q3][Q4]",
        "lagenradar": {
          "d1": 2,
          "d2": 3,
          "d3": 2,
          "d4": 4,
          "d5": 2,
          "d6": 4,
          "d7": 2,
          "d8": 2
        }
      }
    }
  ],
  "freigabe": {
    "erfassung": {
      "name": "Krisenstab S2 (Funktion, FIKTIV)",
      "datum": "2026-10-14",
      "hz": "FIKTIV"
    },
    "freigabe": {
      "name": "Krisenstab S2 (Funktion, FIKTIV)",
      "datum": "2026-10-14",
      "hz": "FIKTIV"
    },
    "versand": {
      "name": "Krisenstab S2 (Funktion, FIKTIV)",
      "datum": "2026-10-14",
      "hz": "FIKTIV"
    }
  }
}
